{
  "protocol": "commitment/v1",
  "kind": "acceptance",
  "acceptanceId": "b0000000-0000-4000-8000-000000000001",
  "missionId": "11111111-1111-4111-8111-111111111111",
  "pactVersion": 1,
  "agentId": "33333333-3333-4333-8333-333333333333",
  "keyId": "b0000000-0000-4000-8000-000000000002",
  "pactDigest": "HnavHPOFRHxw1qf08QBBLrhuPFU--glfe0cO4PROY3U",
  "signature": "geeS8OfkZu58SbruseOyMNxOx99WeNxotlKprYIsx-wJumv1iMANhB8JidULFPmTjDs-wuATE4w6vJ0URig2IA",
  "acceptedAt": "2026-08-26T12:22:00.000Z"
}
